{
  "schemaVersion": "0.1",
  "project": {
    "id": "019fdbdc-23c3-4463-a140-a087267a0001",
    "name": "BrushMachine",
    "displayName": "AutomationBase Brush Machine Integration",
    "description": "Golden-sample integration model. Existing command, request and aggregate machine-status DUTs remain externally owned.",
    "prefix": "BM",
    "namespace": "BM",
    "etabLibrary": {
      "placeholder": "ETAB",
      "version": "0.1.0.3"
    },
    "twinCAT": {
      "version": "3.1.4024.74",
      "plcProject": "AutomationBase_Beispiel.plcproj"
    },
      "generation": {
        "generatedRoot": "Generated",
        "applicationRoot": "Application",
        "createUserStubs": false,
        "programCallStructure": false,
        "relationWiring": true
    }
  },
  "nodes": [
    {
      "id": "10000000-0000-4000-8000-000000000001",
      "kind": "applicationUnit",
      "name": "Machine",
      "symbolStem": "Machine",
      "displayName": "Brush Machine",
      "description": "Master application unit for machine state and recovery command.",
      "role": "machine",
      "generate": {
        "commandEnum": false,
        "requestType": false,
        "statusType": false,
        "baseFunctionBlock": true,
        "instance": true,
        "instanceType": "FB_BM_Machine",
        "callInProgram": true
      },
      "commands": [
        {
          "id": "11000000-0000-4000-8000-000000000001",
          "name": "NoAction",
          "displayName": "No action",
          "enumValue": 0,
          "etabCommand": "NoAction"
        },
        {
          "id": "11000000-0000-4000-8000-000000000002",
          "name": "Reset",
          "displayName": "Reset",
          "enumValue": 10,
          "etabCommand": "Reset"
        },
        {
          "id": "11000000-0000-4000-8000-000000000003",
          "name": "Start",
          "displayName": "Start automatic mode",
          "enumValue": 20,
          "etabCommand": "Start"
        },
        {
          "id": "11000000-0000-4000-8000-000000000004",
          "name": "Homing",
          "displayName": "Home machine",
          "enumValue": 25,
          "etabCommand": "Homing"
        },
        {
          "id": "11000000-0000-4000-8000-000000000005",
          "name": "Stop",
          "displayName": "Controlled stop",
          "enumValue": 30,
          "etabCommand": "Stop"
        },
        {
          "id": "11000000-0000-4000-8000-000000000006",
          "name": "Abort",
          "displayName": "Abort",
          "enumValue": 40,
          "etabCommand": "Abort"
        },
        {
          "id": "11000000-0000-4000-8000-000000000007",
          "name": "Clear",
          "displayName": "Clear",
          "enumValue": 50,
          "etabCommand": "Clear"
        },
        {
          "id": "11000000-0000-4000-8000-000000000008",
          "name": "Recover",
          "displayName": "Recover machine",
          "enumValue": 100,
          "etabCommand": "User"
        }
      ],
      "requestPayload": [],
      "statusPayload": [
        {
          "id": "11100000-0000-4000-8000-000000000001",
          "name": "bReadyForCycle",
          "dataType": "BOOL"
        },
        {
          "id": "11100000-0000-4000-8000-000000000002",
          "name": "bRecoveryRequested",
          "dataType": "BOOL"
        },
        {
          "id": "11100000-0000-4000-8000-000000000003",
          "name": "eLastMode",
          "dataType": "ET.eMODE"
        },
        {
          "id": "11100000-0000-4000-8000-000000000004",
          "name": "eLastState",
          "dataType": "ET.eSTATE"
        }
      ],
      "applicationUnit": {
        "startMode": "ET.eMODE.AUTO",
        "homingMode": "ET.eMODE.INIT",
        "stopMode": "ET.eMODE.IDLE",
        "keepRemoteControl": false,
        "setMachineErrorOnCommandError": true,
        "command": {
          "startState": 1,
          "resetErrorOnStart": true
        }
      },
      "mtp": {
        "exposed": false,
        "procedures": []
      }
    },
    {
      "id": "20000000-0000-4000-8000-000000000001",
      "kind": "applicationUnit",
      "name": "MotionUnit",
      "symbolStem": "Motion",
      "displayName": "Motion Unit",
      "description": "Exclusive owner of all six axis commands.",
      "role": "motion",
      "generate": {
        "commandEnum": false,
        "requestType": false,
        "statusType": true,
        "baseFunctionBlock": true,
        "instance": true,
        "instanceType": "FB_BM_MotionUnit",
        "callInProgram": true
      },
      "commands": [
        {
          "id": "21000000-0000-4000-8000-000000000001",
          "name": "NoAction",
          "displayName": "No action",
          "enumValue": 0,
          "etabCommand": "NoAction"
        },
        {
          "id": "21000000-0000-4000-8000-000000000002",
          "name": "HomeAll",
          "displayName": "Home all axes",
          "enumValue": 10,
          "etabCommand": "User"
        },
        {
          "id": "21000000-0000-4000-8000-000000000003",
          "name": "MoveAllSafe",
          "displayName": "Move all axes safe",
          "enumValue": 20,
          "etabCommand": "User"
        },
        {
          "id": "21000000-0000-4000-8000-000000000004",
          "name": "MeasureLength",
          "displayName": "Measure workpiece length",
          "enumValue": 30,
          "etabCommand": "User"
        },
        {
          "id": "21000000-0000-4000-8000-000000000005",
          "name": "ReturnX1Start",
          "displayName": "Return X1 to start",
          "enumValue": 40,
          "etabCommand": "User"
        },
        {
          "id": "21000000-0000-4000-8000-000000000006",
          "name": "PositionSeamApproach",
          "displayName": "Position seam approach",
          "enumValue": 50,
          "etabCommand": "User"
        },
        {
          "id": "21000000-0000-4000-8000-000000000007",
          "name": "ApplySeamInfeed",
          "displayName": "Apply seam infeed",
          "enumValue": 55,
          "etabCommand": "User"
        },
        {
          "id": "21000000-0000-4000-8000-000000000008",
          "name": "ExecuteSynchronizedSeamPass",
          "displayName": "Execute synchronized seam pass",
          "enumValue": 60,
          "etabCommand": "User"
        },
        {
          "id": "21000000-0000-4000-8000-000000000009",
          "name": "RetractSeamBrushes",
          "displayName": "Retract seam brushes",
          "enumValue": 70,
          "etabCommand": "User"
        },
        {
          "id": "21000000-0000-4000-8000-00000000000a",
          "name": "PositionEndFaceFront",
          "displayName": "Position front end face",
          "enumValue": 80,
          "etabCommand": "User"
        },
        {
          "id": "21000000-0000-4000-8000-00000000000b",
          "name": "ExecuteEndFaceFront",
          "displayName": "Execute front end face",
          "enumValue": 90,
          "etabCommand": "User"
        },
        {
          "id": "21000000-0000-4000-8000-00000000000c",
          "name": "PositionEndFaceRear",
          "displayName": "Position rear end face",
          "enumValue": 100,
          "etabCommand": "User"
        },
        {
          "id": "21000000-0000-4000-8000-00000000000d",
          "name": "ExecuteEndFaceRear",
          "displayName": "Execute rear end face",
          "enumValue": 110,
          "etabCommand": "User"
        },
        {
          "id": "21000000-0000-4000-8000-00000000000e",
          "name": "ParkAll",
          "displayName": "Park all axes",
          "enumValue": 120,
          "etabCommand": "User"
        },
        {
          "id": "21000000-0000-4000-8000-00000000000f",
          "name": "RecoverToUnloadPosition",
          "displayName": "Recover to unload position",
          "enumValue": 130,
          "etabCommand": "User"
        },
        {
          "id": "21000000-0000-4000-8000-000000000010",
          "name": "StopAll",
          "displayName": "Stop all axes",
          "enumValue": 140,
          "etabCommand": "User"
        },
        {
          "id": "21000000-0000-4000-8000-000000000011",
          "name": "AbortAll",
          "displayName": "Abort all axes",
          "enumValue": 150,
          "etabCommand": "User"
        }
      ],
      "requestPayload": [
        {
          "id": "22000000-0000-4000-8000-000000000001",
          "name": "stJobData",
          "dataType": "ST_BM_JobData"
        }
      ],
      "statusPayload": [
        {
          "id": "22100000-0000-4000-8000-000000000001",
          "name": "bAllHomed",
          "dataType": "BOOL"
        },
        {
          "id": "22100000-0000-4000-8000-000000000002",
          "name": "bAllSafe",
          "dataType": "BOOL"
        },
        {
          "id": "22100000-0000-4000-8000-000000000003",
          "name": "bAllStandstill",
          "dataType": "BOOL"
        },
        {
          "id": "22100000-0000-4000-8000-000000000004",
          "name": "bSynchronized",
          "dataType": "BOOL"
        },
        {
          "id": "22100000-0000-4000-8000-000000000005",
          "name": "fMeasuredLength",
          "dataType": "LREAL"
        }
      ],
      "applicationUnit": {
        "startMode": "ET.eMODE.AUTO",
        "homingMode": "ET.eMODE.INIT",
        "stopMode": "ET.eMODE.IDLE",
        "keepRemoteControl": false,
        "setMachineErrorOnCommandError": true,
        "command": {
          "startState": 1,
          "resetErrorOnStart": true
        }
      },
      "mtp": {
        "exposed": false,
        "procedures": []
      }
    },
    {
      "id": "30000000-0000-4000-8000-000000000001",
      "kind": "applicationUnit",
      "name": "WorkpieceUnit",
      "symbolStem": "Workpiece",
      "displayName": "Workpiece Unit",
      "description": "Exclusive owner of door, vacuum, blow-off and laser commands.",
      "role": "workpiece",